{
 "schema": "s1flow/split@1",
 "seed": 1,
 "test_share": 0.3,
 "at": "2026-10-15T21:54:13Z",
 "source": "initial",
 "assign": {
  "#23763": "train",
  "#26153": "train",
  "#27012": "train",
  "#24828": "train"
 },
 "uses": [
  {
   "at": "2026-10-15T21:54:13Z",
   "by": "check",
   "what": "gh-ruff-area@v1"
  }
 ]
}
